dataset_id,dataset_code,dataset_label,definition,vendor_code,concept_code,geo_level_code,frequency_code,source_schema,pipeline_status,coverage_pct,first_vintage,is_active,data_status_code,is_motherduck_served,last_refresh_date,opco_code,product_type_codes
DS_085,cybersyn_fhfa_uniform_appraisal_timeseries,FHFA uniform appraisal UAD (Cybersyn),FHFA Uniform Appraisal Dataset from SOURCE_SNOW.US_REAL_ESTATE FHFA_UNIFORM_APPRAISAL_*; **county** **`TRANSFORM.DEV.FACT_FHFA_UNIFORM_APPRAISAL_COUNTY`**; **CBSA** **`FACT_FHFA_UNIFORM_APPRAISAL_CBSA`**; superset **`FACT_FHFA_UNIFORM_APPRAISAL`**,fhfa,home_price,county,monthly,SOURCE_SNOW.US_REAL_ESTATE,transform_dev,90.0,1995-01-01,TRUE,active,FALSE,,,
DS_086,lodes_workplace_hex_inflow_annual,LEHD LODES workplace H3 R8 inflow (annual),Inbound commuter flows summarized at workplace H3 R8 hex from **`TRANSFORM.DEV.FACT_LODES_OD_WORKPLACE_HEX_ANNUAL`**; feeds employment-center classification. Lineage: **`FACT_LODES_OD_H3_R8_ANNUAL`** → **TRANSFORM.LODES.OD_H3_R8** — no ANALYTICS.FACTS,lehd,employment,cbsa,annual,TRANSFORM.DEV,transform_dev,99.0,2010-01-01,TRUE,active,FALSE,,,
DS_087,corridor_employment_centers_h3_r8_annual,Corridor employment centers (H3 R8),Classified employment centers at H3 R8 from **`TRANSFORM.DEV.REF_CORRIDOR_EMPLOYMENT_CENTERS`**; same logic as pretium-ai-dbt reference model materialized under DEV,internal,employment,cbsa,annual,TRANSFORM.DEV,transform_dev,99.0,2010-01-01,TRUE,active,FALSE,,,
DS_088,lodes_h3_r8_workplace_gravity_annual,LEHD LODES BG→H3 R8 workplace gravity,Area-weighted block-group OD jobs apportioned to workplace H3 R8 hexes **`TRANSFORM.DEV.FACT_LODES_H3R8_WORKPLACE_GRAVITY`**. Lineage: **TRANSFORM.LODES.OD_BG** + **REFERENCE.GEOGRAPHY.BLOCKGROUP_H3_R8_POLYFILL** (SnowSQL `blockgroup_h3_r8_polyfill.sql`),lehd,employment,cbsa,annual,TRANSFORM.DEV,transform_dev,99.0,2010-01-01,TRUE,active,FALSE,,,
DS_089,lodes_nearest_employment_center_h3_r8_annual,Nearest employment center distance (H3 R8),Precomputed H3 grid distance from each CBSA hex to nearest classified center **`TRANSFORM.DEV.FACT_LODES_NEAREST_CENTER_H3_R8_ANNUAL`**. Uses **REFERENCE.GEOGRAPHY.BLOCKGROUP_H3_R8_POLYFILL** (`bridge_bg_h3_r8_polyfill`) + **`REF_CORRIDOR_EMPLOYMENT_CENTERS`**,lehd,employment,cbsa,annual,TRANSFORM.DEV,transform_dev,99.0,2010-01-01,TRUE,active,FALSE,,,
