metric_derived_id,metric_derived_code,metric_derived_label,definition,analytics_layer_code,function_code,model_type_code,estimate_type_code,primary_metric_code,concept_code,geo_level_code,frequency_code,data_status_code,is_active
MDV_001,rent_market_monthly_spine,Market rent monthly spine (analytics),Read surface from TRANSFORM.DEV concept_rent_market_monthly into ANALYTICS for cohort medians z-scores and vs-market ratios per MODEL_FEATURE_ESTIMATION_PLAYBOOK. dbt model feature_rent_market_monthly_spine.sql alias feature_rent_market_monthly. Snowflake ANALYTICS.DBT_DEV.FEATURE_RENT_MARKET_MONTHLY. Grain vendor_code month_start geo from concept.,feature,index,,,,rent,cbsa,monthly,active,TRUE
MDV_002,rent_value_score_cbsa_example,CBSA rent value score (example),Illustrative MODEL_* composite score placeholder; replace with production model when MODEL_* ships. Ties model_type composite to rent concept at CBSA monthly grain.,model,,score,,,rent,cbsa,monthly,under_review,TRUE
MDV_003,effective_rent_interval_lower_example,Effective rent lower bound (example),Illustrative ESTIMATE_* lower interval row; pair with estimate_type_code=point when point+interval forecasts exist per MODEL_FEATURE_ESTIMATION_PLAYBOOK §4.,estimate,,,lower,,rent,cbsa,monthly,active,TRUE
MDV_004,listings_velocity_monthly_spine,Zillow listings velocity monthly spine (analytics),Union read surface over Zillow research FACT_ZILLOW_DAYS_ON_MARKET_AND_PRICE_CUTS and FACT_ZILLOW_FOR_SALE_LISTINGS with catalog metric_id MET_042 (metric_code zillow_days_on_market_and_price_cuts_metric_value) vs MET_043 per SERVING_DEMO_METRICS_CATALOG_MAP. dbt model feature_listings_velocity_monthly_spine.sql alias feature_listings_velocity_monthly.,feature,index,,,zillow_days_on_market_and_price_cuts_metric_value,listings,zip,monthly,active,TRUE
MDV_005,rent_psf_median_geo_feature_planned,Rent PSF median FEATURE (planned),"Placeholder FEATURE registry; tie inputs via metric_derived_input. When MET_052 promotes, set primary_metric_code to rent_median_psf_zip_monthly_planned and is_active=TRUE after ANALYTICS path is documented.",feature,index,,,,rent,zip,monthly,under_review,FALSE
MDV_006,tightness_score_cbsa_model_planned,Market tightness MODEL (planned),Placeholder composite MODEL at CBSA monthly; metric_derived_input lists DOM/listings/HUD CBSA controls until MODEL_* ships.,model,,composite,,,absorption,cbsa,monthly,under_review,FALSE
MDV_007,arbitrage_score_lower_interval_estimate_planned,Arbitrage lower ESTIMATE (planned),Placeholder ESTIMATE interval row for corridor arbitrage stack (WL_022); metric_derived_input ties CoStar/Markerr rent until production estimate lands.,estimate,,,lower,,rent,cbsa,monthly,under_review,FALSE
MDV_008,multifamily_market_ranker_monthly_spine,Multifamily market ranker monthly spine (analytics),County-month FEATURE panel on ANALYTICS.DBT_DEV.FEATURE_MULTIFAMILY_MARKET_RANKER_MONTHLY combining Markerr rent Cherre stock RCA construction ACS and BLS LAUS inputs per feature_multifamily_market_ranker_monthly_spine.sql.,feature,index,,,,rent,county,monthly,active,TRUE
